{
  "$schema": "http://json-schema.org/draft-07/schema#",
  "$id": "https://aerotwin.ai/schemas/TwinState.schema.json",
  "title": "TwinState",
  "description": "Synchronized virtual engine state derived from telemetry. Producer: M2 (Digital Twin). Consumers: M3, M4, M5.",
  "type": "object",
  "required": ["engineId", "missionId", "correlationId", "stateTime", "load", "margins", "derivedFeatures", "stateQuality", "producerVersion"],
  "additionalProperties": true,
  "properties": {
    "engineId": { "type": "string" },
    "schemaVersion": { "type": "string", "description": "Optional additive schema version. v1 payloads may omit this." },
    "missionId": { "type": "string" },
    "correlationId": { "type": "string" },
    "stateTime": { "type": "string", "format": "date-time", "description": "UTC ISO 8601 time this state estimate applies to." },
    "producerVersion": { "type": "string" },
    "load": {
      "type": "number",
      "minimum": 0,
      "maximum": 100,
      "description": "Estimated engine load, percent of rated capacity."
    },
    "margins": {
      "type": "object",
      "required": ["tempMarginC", "pressureMarginKpa", "vibrationMarginMmS"],
      "additionalProperties": false,
      "properties": {
        "tempMarginC": { "type": "number", "description": "Headroom to temperature limit, Celsius. Negative means limit exceeded." },
        "pressureMarginKpa": { "type": "number", "description": "Headroom to pressure limit, kilopascals. Negative means limit exceeded." },
        "vibrationMarginMmS": { "type": "number", "description": "Headroom to vibration limit, mm/s. Negative means limit exceeded." }
      }
    },
    "derivedFeatures": {
      "type": "object",
      "required": ["rollingMeanRpm", "rollingStdVibration", "rateOfChangeOilTempCPerMin", "sampleWindowSeconds"],
      "additionalProperties": true,
      "properties": {
        "rollingMeanRpm": { "type": "number" },
        "rollingStdVibration": { "type": "number" },
        "rateOfChangeOilTempCPerMin": { "type": "number" },
        "sampleWindowSeconds": { "type": "number", "minimum": 0 },
        "featureVersion": { "type": "string" },
        "chtMaxC": { "type": "number" },
        "chtMeanC": { "type": "number" },
        "chtSpreadC": { "type": "number" },
        "chtSlopeCPerMin": { "type": "number" },
        "egtMaxC": { "type": "number" },
        "egtMeanC": { "type": "number" },
        "egtSpreadC": { "type": "number" },
        "egtSlopeCPerMin": { "type": "number" },
        "oilPressureDeviationKpa": { "type": "number" },
        "oilTempDeviationC": { "type": "number", "description": "Measured oil temperature minus M2 context-adjusted expected value." },
        "coolantTempDeviationC": { "type": "number", "description": "Measured coolant temperature minus M2 context-adjusted expected value." },
        "vibrationDeviationMmS": { "type": "number", "description": "Measured vibration minus M2 context-adjusted expected value." },
        "expectedOilTempC": { "type": "number", "description": "Environment-aware demonstrator baseline, not a certified engine limit." },
        "expectedCoolantTempC": { "type": "number", "description": "Environment-aware demonstrator baseline, not a certified engine limit." },
        "expectedOilPressureKpa": { "type": "number", "description": "Environment-aware demonstrator baseline, not a certified engine limit." },
        "expectedVibrationMmS": { "type": "number", "description": "Environment-aware demonstrator baseline, not a certified engine limit." },
        "fuelFlowDeviationLph": { "type": "number" },
        "injectionTimingDeviationDeg": { "type": "number" },
        "alternatorVoltageMarginV": { "type": "number" },
        "batteryVoltageMarginV": { "type": "number" },
        "vibrationRollingMeanMmS": { "type": "number" },
        "vibrationSlopeMmSPerMin": { "type": "number" },
        "vibrationPeakMmS": { "type": "number" },
        "missingSensorRatio": { "type": "number", "minimum": 0, "maximum": 1 },
        "invalidSensorRatio": { "type": "number", "minimum": 0, "maximum": 1 },
        "stateConfidence": { "type": "number", "minimum": 0, "maximum": 1 },
        "reasonCodes": { "type": "array", "items": { "type": "string" } }
      }
    },
    "stateQuality": {
      "type": "string",
      "enum": ["GOOD", "STALE", "DEGRADED"],
      "description": "GOOD = fresh, complete input. STALE = no recent update within expected cadence. DEGRADED = built from missing/low-quality telemetry."
    },
    "syncLagMs": {
      "type": "number",
      "minimum": 0,
      "description": "Milliseconds between the source telemetry timestamp and this state being published."
    },
    "aircraftId": {
      "type": "string",
      "description": "Optional. Aircraft identifier (from the M1 frame's aircraftId, else the M2 default)."
    },
    "subsystemState": {
      "type": "object",
      "description": "Optional. Discrete subsystem categorisation derived by M2 from context-adjusted deviations and engine-profile limits.",
      "required": ["thermalState", "lubricationState", "combustionState", "vibrationState", "overallState"],
      "additionalProperties": true,
      "properties": {
        "thermalState": { "type": "string", "enum": ["normal", "elevated", "critical"] },
        "lubricationState": { "type": "string", "enum": ["healthy", "degraded", "critical"] },
        "combustionState": { "type": "string", "enum": ["stable", "unstable"] },
        "vibrationState": { "type": "string", "enum": ["normal", "elevated", "severe"] },
        "overallState": { "type": "string", "enum": ["nominal", "degraded", "critical"] },
        "basis": { "type": "string", "enum": ["context-baseline", "absolute-limits"] },
        "reasons": { "type": "array", "items": { "type": "string" } }
      }
    }
  }
}
